{"assets":[{"id":"asset_4c8ef5f5-fe8b-439f-a912-94f74eb46757","manifest":"assets/851ce0385c536821240f40caaa80fe16a0f508e004129964726d0a6c8fb19460/manifest.json","manifestHash":"61538ff509d0fe48ee4f7bca8b626a9d2516c003ccce87081c25d87069c7b094","name":"rich_engine"},{"id":"asset_4c8ef5f5-fe8b-439f-a912-94f74eb46757_copy","manifest":"assets/528bf825407be411c71e98fc9467125dfa5ff972c61169c710c237a415a68bbf/manifest.json","manifestHash":"917384c3ca79cda851d7f1d5e12f57cd5f731e2f9767c6fddd271a5d4ae639a7","name":"rich_engine"}],"format":"chameleon-package","target":"canvas2d","version":"0.2.0"}
