{"assets":[{"id":"asset_f8b3f81d-39e8-4ecc-9372-e192a7ef0cf7","manifest":"assets/03b4123639f6fc2df8ff0edd2ec0d2da52159ca822652e50a1b13fee3248e340/manifest.json","manifestHash":"cfa8c186c7b1474f3047d914bb42c7c71662d25b853e99e5cca20e34cbd86719","name":"rich_engine"},{"id":"asset_f8b3f81d-39e8-4ecc-9372-e192a7ef0cf7_copy","manifest":"assets/f8ec2f1efdaaae74e1f708a4af0a3af5cffe527d9f1ebe45bc58a7c488b1d588/manifest.json","manifestHash":"9e851650ad04f876324ece12b47e001567d3e3a8ecb9c370de7e084cc5a2b350","name":"rich_engine"}],"format":"chameleon-package","target":"canvas2d","version":"0.2.0"}
