{"assets":[{"id":"asset_a90e6969-a839-4f54-bbbb-57b433c97fa0","manifest":"assets/f7926077b2b9a898429099990bd0a3a872203abfe85f18da3c0fb548310b7091/manifest.json","manifestHash":"23bf3aea5b538c4691ed6804fbc9ce48e052e7d91bf93ea4b04b2f637d3fe9d4","name":"rich_engine"},{"id":"asset_a90e6969-a839-4f54-bbbb-57b433c97fa0_copy","manifest":"assets/058277e75acd8fa4cd727986f6830c891dc9dd932a4f3283b0a5809a62fe3b30/manifest.json","manifestHash":"02626f29c63910cbf9fcf239b56c101b0cb4093b9159cdf0e07d24078e75881b","name":"rich_engine"}],"format":"chameleon-package","target":"canvas2d","version":"0.2.0"}
